{
  "$schema": "https://json-schema.org/draft/2020-12/schema",
  "$id": "https://crusher-to-the-bridge/schemas/sentinel_observations.schema.json",
  "title": "SentinelObservations",
  "description": "Per-voyage sentinel observation bundle: clinical line list plus wastewater samples, keyed to a voyage_config itinerary. Consumed by picard_framework/analysis/sentinel; see docs/sentinel/sentinel_surveillance_spec.md.",
  "type": "object",
  "additionalProperties": false,
  "required": ["voyage_id", "ship_id", "clinical_cases"],
  "properties": {
    "schema_version": { "type": "string" },
    "voyage_id": { "type": "string", "minLength": 1 },
    "ship_id": { "type": "string", "minLength": 1 },
    "platform_class": { "type": "string" },
    "n_passengers": { "type": "integer", "minimum": 0 },
    "n_crew": { "type": "integer", "minimum": 0 },
    "epoch_duration_hours": { "type": "number", "exclusiveMinimum": 0 },
    "observation_end_epoch": {
      "type": "integer",
      "minimum": 1,
      "description": "Last epoch under observation. Onsets after this epoch are unobserved (right censoring)."
    },
    "clinical_cases": {
      "type": "array",
      "items": { "$ref": "#/$defs/clinical_case" }
    },
    "wastewater_samples": {
      "type": "array",
      "items": { "$ref": "#/$defs/wastewater_sample" }
    },
    "exposure_totals": {
      "type": "object",
      "description": "Person-hours ashore per port_id — the hazard denominator. Observed from the run rather than inferred from itinerary fractions.",
      "additionalProperties": { "$ref": "#/$defs/exposure_total" }
    },
    "provisioning": {
      "type": "object",
      "description": "Provisioned servings consumed per source_id — the provisioning-channel exposure (servings x per-serving hazard). A source_id is a supply-chain entity, not a port call; docs/sentinel/sentinel_source_market_revision.md.",
      "additionalProperties": { "$ref": "#/$defs/provisioning_source" }
    },
    "embarkation": {
      "$ref": "#/$defs/embarkation"
    },
    "covariates": {
      "type": "object",
      "description": "Voyage-level covariates (market structure) multiplying the fleet model's import channels; a name absent from another voyage's covariates reads as 0.",
      "additionalProperties": { "type": "number" }
    },
    "truth_introductions": {
      "type": "array",
      "description": "Simulated ground truth: which person acquired at which port. Present only for synthetic voyages (no field dataset has it); used to score hazard recovery, never as model input.",
      "items": { "$ref": "#/$defs/truth_introduction" }
    },
    "notes": { "type": "string" }
  },
  "$defs": {
    "truth_introduction": {
      "type": "object",
      "additionalProperties": false,
      "required": ["person_id", "epoch", "port_id"],
      "properties": {
        "person_id": { "type": "string", "minLength": 1 },
        "epoch": { "type": "integer", "minimum": 1 },
        "port_id": { "type": "string", "minLength": 1 },
        "pathogen": {
          "oneOf": [{ "type": "null" }, { "type": "string" }]
        }
      }
    },
    "exposure_total": {
      "type": "object",
      "additionalProperties": false,
      "required": ["person_hours_passenger", "person_hours_crew"],
      "properties": {
        "person_hours_passenger": { "type": "number", "minimum": 0 },
        "person_hours_crew": { "type": "number", "minimum": 0 },
        "n_passengers_ashore": { "type": "integer", "minimum": 0 },
        "n_crew_ashore": { "type": "integer", "minimum": 0 }
      }
    },
    "strata_counts": {
      "type": "object",
      "description": "Counts keyed by stratum (passenger and/or crew).",
      "additionalProperties": false,
      "properties": {
        "passenger": { "type": "number", "minimum": 0 },
        "crew": { "type": "number", "minimum": 0 }
      }
    },
    "strata_series": {
      "type": "object",
      "description": "Per-epoch counts keyed by stratum.",
      "additionalProperties": false,
      "properties": {
        "passenger": {
          "type": "array",
          "items": { "type": "number", "minimum": 0 }
        },
        "crew": {
          "type": "array",
          "items": { "type": "number", "minimum": 0 }
        }
      }
    },
    "strata_markets": {
      "type": "object",
      "description": "Market id per stratum — a line's consumer market and crew labour market are different pools.",
      "additionalProperties": false,
      "minProperties": 1,
      "properties": {
        "passenger": { "type": "string", "minLength": 1 },
        "crew": { "type": "string", "minLength": 1 }
      }
    },
    "provisioning_source": {
      "type": "object",
      "additionalProperties": false,
      "anyOf": [
        { "required": ["servings_per_epoch"] },
        { "required": ["servings_total", "service_window_epochs"] }
      ],
      "properties": {
        "servings_per_epoch": { "$ref": "#/$defs/strata_series" },
        "servings_total": { "$ref": "#/$defs/strata_counts" },
        "service_window_epochs": {
          "type": "array",
          "minItems": 2,
          "maxItems": 2,
          "items": { "type": "integer", "minimum": 1 },
          "description": "[first, last] service epochs; a servings_total is spread uniformly over the window."
        }
      }
    },
    "embarkation": {
      "type": "object",
      "additionalProperties": false,
      "required": ["markets"],
      "properties": {
        "markets": { "$ref": "#/$defs/strata_markets" },
        "n_boarded": {
          "$ref": "#/$defs/strata_counts",
          "description": "Headcount boarding per stratum; defaults to n_passengers/n_crew when absent."
        },
        "embark_epoch": {
          "oneOf": [{ "type": "null" }, { "type": "integer", "minimum": 1 }],
          "description": "Epoch imports count at; defaults to the embarkation day's first epoch."
        }
      }
    },
    "clinical_case": {
      "type": "object",
      "additionalProperties": false,
      "required": ["person_id", "onset_epoch", "crew"],
      "properties": {
        "person_id": { "type": "string", "minLength": 1 },
        "onset_epoch": {
          "type": "integer",
          "minimum": 1,
          "description": "1-indexed epoch of symptom onset (not of report)."
        },
        "crew": { "type": "boolean" },
        "pathogen": {
          "oneOf": [{ "type": "null" }, { "type": "string" }]
        },
        "genotype": {
          "description": "Genotype this case was typed as by a delivered sequencing assay — the reported call, which accuracy can make wrong, not the host's true lineage. Null when the case was never typed (no strain tracking, no assay, or a specimen that failed its Ct gate or read floor).",
          "oneOf": [{ "type": "null" }, { "type": "string" }]
        },
        "hours_ashore": {
          "type": "object",
          "description": "Hours ashore per port_id for this person. Keys must exist in the voyage itinerary; 0 or omitted means stayed aboard.",
          "additionalProperties": { "type": "number", "minimum": 0 }
        },
        "reported_via": {
          "type": "string",
          "enum": ["sick_call", "screening", "cascade", "wearable", "unreported"],
          "description": "Detection channel; drives the reporting-probability term of the observation model."
        },
        "report_epoch": {
          "description": "Epoch the case entered surveillance, if later than onset.",
          "oneOf": [{ "type": "null" }, { "type": "integer", "minimum": 1 }]
        }
      }
    },
    "wastewater_sample": {
      "type": "object",
      "additionalProperties": false,
      "required": ["sample_epoch", "collection_point", "pathogen"],
      "properties": {
        "sample_epoch": { "type": "integer", "minimum": 1 },
        "collection_point": {
          "type": "string",
          "minLength": 1,
          "description": "Wastewater collection zone label (CTB sequencing modality zone)."
        },
        "pathogen": { "type": "string", "minLength": 1 },
        "pathogen_id": {
          "type": "string",
          "description": "ABM pathogen profile id the sample counted infections of (e.g. norwalk_gi). 'pathogen' is the delay-catalog key the fit filters on, and the two are deliberately different vocabularies — but a truth-vs-observed join needs the id, so it is carried here. Empty when the run did not name one; 'pathogen' is then the only key available."
        },
        "assay_mode": {
          "type": "string",
          "enum": ["qpcr", "amplicon", "metagenomic", "long_read"],
          "description": "Laboratory mode that produced the row. Absent means metagenomic, the mode that predates the switch. Read fields and concentration fields are alternatives: qpcr rows have no library, metagenomic rows have no Ct."
        },
        "pathogen_reads": { "type": "integer", "minimum": 0 },
        "total_reads": {
          "type": "integer",
          "minimum": 0,
          "description": "Library depth. pathogen_reads <= total_reads is enforced by the loader. Omitted or 0 for a mode that does not sequence, and 0 for a sequencing mode whose sample failed the detection gate (no library is made off a negative well)."
        },
        "clr_anomaly_score": {
          "type": "number",
          "description": "GRUMB centered-log-ratio anomaly score for this pathogen."
        },
        "ct_value": {
          "description": "Reported cycle threshold. Null for a non-detect: a negative well has no Ct, and the evidence is the bound in lod_copies_per_l.",
          "oneOf": [{ "type": "null" }, { "type": "number" }]
        },
        "detected": {
          "description": "Whether the sample cleared the assay's limit of detection. Null for modes with no detection gate.",
          "oneOf": [{ "type": "null" }, { "type": "boolean" }]
        },
        "concentration_copies_per_l": {
          "description": "Genome copies per litre implied by the reported Ct, or supplied by an external qPCR dataset. Null for a non-detect and for compositional metagenomics, which does not measure copies/L.",
          "oneOf": [{ "type": "null" }, { "type": "number", "minimum": 0 }]
        },
        "lod_copies_per_l": {
          "description": "Copies/L at the assay's limit of detection — the censoring point a non-detect observes.",
          "oneOf": [{ "type": "null" }, { "type": "number", "minimum": 0 }]
        },
        "primer_target": {
          "description": "Amplicon primer set used.",
          "oneOf": [{ "type": "null" }, { "type": "string", "minLength": 1 }]
        },
        "turnaround_hours": {
          "description": "Instrument turnaround for a confirmatory (long-read) run.",
          "oneOf": [{ "type": "null" }, { "type": "number", "minimum": 0 }]
        },
        "genotype": {
          "description": "Consensus lineage of the sample: the most abundant lineage the library resolved, the configured long-read reference, or null when nothing was typed.",
          "oneOf": [{ "type": "null" }, { "type": "string" }]
        },
        "lineage_status": {
          "description": "Outcome of strain deconvolution on this library. 'not_configured' when the assay does not attempt it, 'no_composition' when the pool carries no tracked lineage, 'insufficient_reads'/'below_reporting_floor' when the library could not resolve one.",
          "oneOf": [
            { "type": "null" },
            {
              "type": "string",
              "enum": [
                "not_configured",
                "no_template",
                "no_composition",
                "insufficient_reads",
                "below_reporting_floor",
                "deconvolved"
              ]
            }
          ]
        },
        "lineage_calls": {
          "type": "array",
          "description": "Lineages reported from the on-target reads, most abundant first. Reads sum to at most pathogen_reads; the remainder is lineage_unresolved_reads.",
          "items": { "$ref": "#/$defs/lineage_call" }
        },
        "lineage_unresolved_reads": {
          "description": "On-target reads not attributed to any reported lineage: below the reporting floor, or from pool mass whose lineage is untracked.",
          "oneOf": [{ "type": "null" }, { "type": "integer", "minimum": 0 }]
        }
      }
    },
    "lineage_call": {
      "type": "object",
      "additionalProperties": false,
      "required": ["genotype", "reads"],
      "properties": {
        "genotype": { "type": "string", "minLength": 1 },
        "reads": { "type": "integer", "minimum": 0 },
        "fraction": { "type": "number", "minimum": 0, "maximum": 1 }
      }
    }
  }
}
